,ug_review,Оценка,Категория,Запрещенные слова
966,На некоторых терминалах считывается с пятого или десятого раза частенько приходится менять карты то ВТБ то сбер,,,
967,"Постоянно слетает авторизация, приходится заново вводить данные.",,,
968,"Пока что работает, показывает баллы",,,
969,"Хорошее приложение, работает уверенно на слабых устройствах в отличии от основного ВК",,,
970,Хороший браузер! 😁,,,
971,"Увидел пару объявлений даром, остальное платно, база в самом начале развития. Пока жиденько... Но удачи.",,,
972,На Honor 9a не запускается,,,
973,"На honor 9 aне работает, запрашивает подтверждение почты, подтверждаю и все заново , запрос , запрос, ужас,",,,
974,Невозможно отправить деньги на счет другого банка,,,
975,"У меня тёмная тема на смартфоне стоит, не критично. Обновлял через магазин приложений смартфона, на этот магазин даже яндекс забил, использую его только когда совсем безвыходная ситуация.",,,
976,"По пин-коду со смартфона можно ведь подтверждения получать, хоть шестизначный код живущий минуту. Видимо все номера телефонов разбазарили, что тут уже не считают их за достоверные данные.",,,
977,Не устраивается....мало мест(1Гб мало??),,,
978,Здравствуйте программа не открываются у меня телфон самсунг а52,,,
979,Не могу зарегистрировать карту . Соответственно и пользоваться невозможно .,,,
980,"После обновления до версии 6.1.1.3367 из RuStore приложение не открывается, постоянно крутится кружок в центре.",,,
981,"После очередного обновления (господи, сколько их уже было!) зайти в приложение можно только со второй попытки... Как же вы задолбали, просто сил уже никаких нет!..",,,
982,Не,,,
983,"Что случилось, ВТБ ?",,,
984,Не работает уже 2ой месяц...,,,
985,Перестало открываться с первого раза и со второго с трудом,,,
986,"ПРиложение хорошее и полезное,но не совсем понятно почему привязывается только к аккаунту Гугл? Можно добавить возможность самому как-нибудь подписать привязанный счет,т.К. я,думаю,что не только я, по номеру счетов не ориентируюсь.",,,
987,"Упростое в использовании. Надёжное, не глючит!",,,
988,"Востановите приложение,  не возможно зайти. Зачем вы его постоянно модернизируете? Ведь все работало нормально. Нет,  надо было залезть своими корявыми рученками.",,,
989,Изменения делаются для удобства пользования приложением в моем представлении. Раньше приходили подарки и было видно от кого в уведомлении. Сейчас все подарки от всех подписаны одной фразой: друг прислал подарок. Это что???,,,
990,Молодцы! Добавили тёмную тему и стало невозможно отсканировать карту.,,,
991,4й день приложение не работает (,,,
992,Перестал открываться.,,,
993,"Не понятно как играть, никого обучения, неудобное управление",,,
994,"Не понятно как играть, ни какого обучения, неудобное управление",,,
995,Не открывается не Lenovo  K13. Сбой при открытии.,,,
996,"Явных изминений, после объявления я не увидел. Как не открывается так и не открывается на Lenovo  K13. Сбой при открытии.",,,
997,Здравствуйте есть ли риск подцепить вредоносное ПО  или что-то тип такого через VPN,,,
998,"Ужас. Одним словом. И ладно бы аббревиатуры, но какие-то дикие сокращения слов считать словами?!",,,
999,"время убивает хорошо🙂играется без напряга, голову особо ломать не надо",2.0,,
1000,Качественное приложение от Госуслуг,2.0,,
1001,Единственное прложение показывающее точную температуру воздуха,2.0,,
1002,Единственное приложение показывающее точную температуру воздуха,2.0,,
1003,Температура завышена на четыре градуса,0.0,1.0,
1004,"Введите возможность оплаты товра через систему быстрых платежей, как на вайлдбериз",1.0,1.0,
1005,Друг страдает от голода не могу уже 3 день перевести ему хоть сколько денег,0.0,0.0,
1006,Тормоз полнейший.,0.0,0.0,
1007,Супер спасибо,2.0,,
1008,"В строке ввода номера для перевода денег ничего не видно,все перекрывает надпись""введите номер телефона ,карты или счета""Уберите эту надпись",0.0,0.0,
1009,Самое лучшее приложение,2.0,,
1010,Что бы паспорт отсканировать надо держать над ним телефон около двух минут пока полоски не забегают. Подпись надо делать поменьше похожую на слово. Например подпись втбмоб),0.0,0.0,
1011,Не работает автозаполнение. Но спасибо за демо-сервер,0.0,0.0,
1012,Проценты не указываются в общем долге по  КК,0.0,0.0,
1013,Это приложение не работает на Honor 30. Зависает на экране заставки.,0.0,0.0,
1014,"На реалми GT MASTER EDITION не работает. При выборе Гугл пишит, внутриния ошибка",0.0,0.0,
1015,Приложение некоретно работает корзина товара нет а показывает 5 товара и немого зайти в корзину выдаёт ошибку,0.0,0.0,
1016,Мало игр а black myth: wukong выйдет на вашей площадке?,0.0,1.0,
1017,Мало игр! а black myth: wukong выйдет на вашей площадке? Компания которая не разрабатывает вроде китайская.,0.0,1.0,
1018,Мало игр! а black myth: wukong выйдет на вашей площадке? Компания которая еë разрабатывает вроде китайская.,0.0,1.0,
1019,"В  магазине пытался оплатить, в итоге после нажатия оплатить сбор подключения к сети. После вообще при новом запуске с ходу даже не даёт сканировать пишет нет подключения к  интернету. Приложение бесполезно не надёжно. delete",0.0,0.0,
1020,После последнего обновления постоянно вылетает приложение,0.0,0.0,
1021,"Уже раз 50 выходило сообщение есть обновление, но оно никогда не может установиться",0.0,0.0,
1022,Лучший банк - лучшее приложение!,2.0,,
1023,"Оплачивает через раз,стоишь тыкаешь тыкаешь результат 0",0.0,0.0,
1024,"Ну приложение ещё молодое, видно по сравнению с другими облачными сервиса и. Со временем допилят. В принципе годное.",1.0,0.0,
1025,"Добрый день, исправьте ошибку загрузки документов кредита",1.0,0.0,
1026,"Некоторые функции не работают. Например, невозможно получить выписку. Обновил приложение, это не помогло.",0.0,0.0,
1027,Отличное приложение!!!Лучше не встречал. Рекомендую!!!,2.0,,
1028,"Не рабочее приложение, виснешь на регистрации - не приходит код подтвеждения",0.0,0.0,
1029,"Повис при регистрации, на e-mail не приходит письмо",0.0,0.0,
1030,"Проблеммы при загрузке, фото. Постоянно выскапивает ""не удалось отправить файл"" да же при закрытом приложении.  Поскольку рядом со мной ни кого нет. Пока повис на этом. Далее если что добаалю.",0.0,0.0,
1031,"Проблеммы при загрузке, фото. Постоянно выскакивает ""не удалось отправить файл"" да же при закрытом приложении.  Поскольку рядом со мной ни кого нет. Пока повис на этом. Далее если что добаалю.",0.0,0.0,
1032,"При запуске требует обновление, поставил здесь.",0.0,0.0,
1033,"Ставлю 1 звезду поскольку у меня в анкете указано ""Женьщины"" при попытке найти симпатию одни ""Мужсины"" был бы разработчик близко - дал бы ему в глаз за такое.",0.0,0.0,
1034,"Ставлю 1 звезду поскольку у меня в анкете указано ""Женьщины"" при попытке найти симпатию одни ""Мужчины"" был бы разработчик близко - дал бы ему в глаз за такое.",0.0,0.0,
1035,"Пока не очень, дальше посмотрим",0.0,0.0,
1036,"Ставлю 1 звезду поскольку у меня в анкете указано ""Женьщины"" при попытке найти симпатию одни ""Мужчины"" был бы разработчик близко - дал бы ему в глаз за такое.",0.0,0.0,
1037,При запуске требует обновление 2.6.11 поставил здесь.,0.0,0.0,
1038,В последней версии 17.6.0.0  глюк  - при входе в раздел с накопительным счетом  приложение вылетает.,0.0,0.0,
1039,В последней версии 17.6.0.0  глюк  - при входе в раздел с накопительным счетом или с картой -  приложение вылетает. До обновления все работало норм.,0.0,0.0,
1040,Не работает! Белый экран и 4 кнопки и все...,0.0,0.0,
1041,Не запускается. Пишет ошибка. Андроид 12,0.0,0.0,
1042,Ну вроде норм,2.0,,
1043,"Отлично, спасибо!",2.0,,
1044,Лучший банк с самым удобным приложением!!,2.0,,
1045,"Мошеннический сервис, необусловленные блокировки и штрафы.",0.0,1.0,
1046,"Само приложение классное! Но работает как-то не очень: притормаживает и постоянно выдаёт ошибку ""не отвечает"".",1.0,0.0,
1047,Не могу войти в приложение,0.0,0.0,
1048,Норм,2.0,,
1049,OZON-шикарное приложение!,2.0,,
1050,"Все очень круто) Заказал елку на НГ, пришла быстро и в отличном состоянии, ни одна иголочка не упала)",2.0,,
1051,"Скачала приложение только через 3 попытки, сайт то виснет, то выдает ошибку. Хочу обратиться к программистам, пожалуйста решите проблему с этим приложением",0.0,0.0,
1052,Все просто ужасно. Неужели у нас нет программистов нормальных,0.0,0.0,
1053,Крутое приложение,2.0,,
1054,Не встанает. Разработчики вы вредители.,0.0,0.0,
1055,"Норм.приложение ,работает эффективно.",2.0,,
1056,Приложение постоянно вылетает...,0.0,0.0,
1057,"Приложение скачал, но оно даже не открывается",0.0,0.0,
1058,"Отличное приложение, все понятно и доступно даже для пенсионеров!",2.0,,
1059,РуСторе пытается обновить той-же версией что у меня установленна. Результат предсказуем - ошибка обновления.,0.0,0.0,
1060,РуСторе пытается обновить той-же версией что у меня установленна. Результат предсказуем - ошибка обновления.,0.0,0.0,
1061,"Почему-то приложение никак не хочет подхватывать ссылки. В настройках включены эти адреса, но в выбор , чем открывать - не попадает.",0.0,0.0,
1062,"Приложение ещё только развивается, но разработчики мыслят в правильном направлении.",2.0,,
1063,"Приложение работает пока 4 звезды, поставлю 5, если сделаете оплату через СБП.",1.0,1.0,
1064,Сначала не смог зарегистрироваться. Потом куда то  пропала обещанная скидка на 100 руб. Промокод - исчез. Снимаю заказ. И не связываюсь больше с этой конторой.Заказ был на 522 рубля.,0.0,0.0,
1065,Игра интересная но реклама измучивает.,1.0,1.0,
1066,К сожалению перестал открывать все передачи после обновления,0.0,0.0,
1067,"После обновления исчезли деньги кешбека,предлагает заново регистрироваться",0.0,0.0,
1068,После обновления не могу открыть.Зависает.Сделайте уже нормальное!,0.0,0.0,
1069,"Не работает очень жаль,а так всё здорово было.",0.0,0.0,
1070,Приложение действительно отличное. В одном приложении собрана коллекция игр в онлайн режиме и самое главное играеш не с ботами а с реальными людьми. Короче разработчики постарались сделать классное приложение моя оценка 5,2.0,,
1071,"Не удобно сделано уведомление об отсутствии подключения к сети (""Нет соединения"") - оно закрывает ~25% рабочей области и часто отображается даже в сети 100 Мбит/с. Возможно стоит сделать его более компактным.",0.0,0.0,
1072,"Стали снимать деньги за уведомления (79 рублей), хотя являюсь зарплатным клиентом, а для них эта услуга-бесплатная!",0.0,1.0,
1073,"В приложении не хватает возможности входа по пин-коду, ну и претензии к скорости обновления информации: уже неделю как НПД оплачен, в моём налоге все оплачено, даже видно, что платёж проведён, в Налоги ФЛ задолженность стабильно будет висеть ещё неделю",0.0,0.0,
1074,"Вообще непонятно для чего, никаких QR кодов для TOTP аутентификации в ЛК ФЛ, ЛК НПД нет",0.0,0.0,
1075,"Приложение было убрано из google play насовсем, похоже. Снова покупай. Мудро сделано. Перенос лицензии со слов автора невозможен. Бизнес такой бизнес. За такое отношение к пользователям оценка не больше единицы",0.0,1.0,
1076,"Неплохо, было. После обновления сломалось приложение, теперь как у всех ""Нет сети""  Когда появится нормальная альбомная ориентация?",0.0,0.0,
1077,"Неплохо, было. После обновления сломалось приложение, теперь как у всех ""Нет сети""  Когда появится нормальная альбомная ориентация?",0.0,0.0,
1078,После очередного обновления весь раздел избранных переводов как будто обнулился. Я не помню всех пререквизитов из них. И что мне делать?,0.0,0.0,
1079,"Отличное приложение! Есть всё необходимое, интерфейс очень интуитивный и дружелюбный, не перегруженный ненужной чепухой. Пользуюсь не только альфой, но, по моему мнению, альфа лучший!)",2.0,,
1080,После обновления не работает автонакопление. Когда восстановят?,0.0,0.0,
1081,"После обновления  приложение стало работать еще хуже.В ФССП вообще не зайдешь,нет связи с сервером.Обновляете и никакого толька нет,еще хуже все становится.",0.0,0.0,
1082,"После обновления  приложение стало работать еще хуже.В ФССП вообще не зайдешь,нет связи с сервером.Обновляете и никакого толка нет,еще хуже все становится.",0.0,0.0,
1083,"ошибку не исправили, входа нет",0.0,0.0,
1084,"Приложение работает некорректно. Карты не видит, не добавляет, не пополняет счёт. Очистка кеша ничего не дала. Заново установив не приходит смс со связью это не связано.",0.0,0.0,
1085,Топ 1 10 из 10,2.0,,
1086,Приложение стало удобнее и понятнее.,2.0,,
1087,"Пока проблем не заметил, но пользоваться удобно. По заполненности транспорта не всегда укладывает, но это мелочи и думаю со временем научат",2.0,,
1088,Почему я не могу войти в приложение?,0.0,0.0,
1089,Работает нормально нареканий нет.,2.0,,
1090,Где можно скачать это приложение для Андроид ТВ?,1.0,,
1091,"Удобное приложение. Когда появилисась проблема, помогли решить её",2.0,,
1092,"Можно обходиться бесплатной версией, и её будет достаточно для человека, но тогда он должен заниматься прям каждый бодий день, иначе результаты будут слабенькими. Касательно премиум версии - всё хорошо. Нет тупого навязывания как в других приложениях.",2.0,,
1093,"В чат нельзя вставить скриншот. Просит дать разрешения на доступ к памяти. При этом приложение само его не запрашивает, а Андроид 13 не знает, что приложению нужно, соответственно в настройках отсутствует пункт о разрешении доступа к памяти.",0.0,0.0,
1094,Не читает qr код для оплаты,0.0,0.0,
1095,"Слишком большое, в асемьлере надо писать",0.0,0.0,
1096,"Неплохо, можно было бы заставку менять)",1.0,,
1097,Полностью согласен. Всё СЛОМАЛИ. 0 звёзд,0.0,0.0,
1098,"Лучшее мобильное приложение для инвестирования для меня! Спасибо разработчикам!) очень нравится в нём работать, как начинающему инвестору; все разделы проработаны и логично построены; очень хорошие курсы в разделе школа инвестора",2.0,,
1099,Не полностью отображается налоговая задолженность.,0.0,0.0,
1100,Постоянно крутит загрузку после входа даже показания не передать,0.0,0.0,
1101,"Всё отлично, просто, удобно.",2.0,,
1102,Хочу видеть реакции в виде эмодзи на коменты к видосам это очень удобно добавьте пожалуйста больше вопросов нет,1.0,0.0,
1103,"Что означает надпись ""недействительный ключ подтверждения"" при попытке выплаты?",0.0,0.0,
1104,"Хорошо бы Маруся активировалась при открытии, мб через виджет) хотелось бы нажать и сразу говорить",1.0,0.0,
1105,"Мало места, увеличить бы. Добавить возможность заходить в облако без установки приложения, через браузер.",1.0,0.0,
1106,"Всё очень сложно, не могу обновить старую карту",0.0,0.0,
1107,"Как поставить ваше приложение по умолчанию, его нет в списке в настройках nfc? Upd: нет ответа, убрал звезду.",0.0,0.0,
1108,"Воруют nft и крипту, привязал свой кошелёк и все украли",0.0,0.0,
1109,"Приколисты. Обновили приложение, а версию не подняли, теперь обновление не показывается и не ставится, если только на чисто ставить... 🤦‍♂️",0.0,0.0,
1110,Лучший онлайн кинотеатр!,2.0,,
1111,Игра огонь!,2.0,,
1112,"Опять несколько дней у меня не открывается профиль, вижутолько пустуб страеицу. Не могу поставить отзы за заказы, посмотреть с понравившиеся товары, видить сообшения. Что это за фокусы?",0.0,0.0,
1113,"Опять несколько дней у меня не открывается профиль, вижу только пустую страницу. Не могу поставить отзывы за заказы, посмотреть с понравившиеся товары, видить сообшения. Что это за фокусы?",0.0,0.0,
