,ug_review,Оценка,Категория,Запрещенные слова
491,"Приложение постоянно дорабатывать! Стало похоже на СБЕР. Банком пользуюсь давно, все на уровне! Огромное спасибо что поглотила этот НЕДОБАНК МИНБАНК, все кто не доволен с мин банка, просто не понимают ничего!",,,
492,Допишем авто выведение. Убытка и прибыли. Часть программы писала больше года. И налоги 13 %.,,,
493,После обновления программы от 21 марта приложение перестало открываться. Планшет Samsung.,,,
494,Шустрый и простой в обращении. Нет надоедливой рекламы.,,,
495,После обновления не открывается!!!!,,,
496,Не работает,,,
497,"Я в шоке с извините(дебилов)которые не понимают, сами подключили рекламу в ТЖ(Тинькофф Журнал)сами и выключайте,банк хороший,те кто ставят 1 вы сочиняете дурь,не можете зайти или заблокировали доступ?есть функция позвонить в банк,и вам все расскажут",,,
498,"Всё дёргается невозможно померить нигоризонталь,ни угол,на картинке черный фон и жолтая полоса ,а у меня серый фон .кароче не работает",0.0,0.0,
499,"У меня тоже не открывается, пишет обновления будут в течении часа, но час длится весь день))))",0.0,0.0,
500,Местоположение не определяет,0.0,0.0,
501,Банк все хуже и хуже. Привет комиссиям с 1 мая.,0.0,1.0,
502,Плохо долго открывается,0.0,0.0,
503,"УЖЕ КАКОЙ ДЕНЬ НЕ ОТКРЫВАЕТСЯ ИГРА "" ИЩИ МОКРОВИЩА"" ..ОДИН ЗЕЛЕНЫЙ ЭКРАН ..ЧТО ЗА ХРЕНЬ ",0.0,0.0,
504,"УЖЕ КАКОЙ ДЕНЬ НЕ ОТКРЫВАЕТСЯ ИГРА "" ИЩИ СОКРОВИЩА"" ..ОДИН ЗЕЛЕНЫЙ ЭКРАН ..ЧТО ЗА ХРЕНЬ ",0.0,0.0,
505,"Сильно кушает, заряд батареи данное приложение .",0.0,0.0,
506,Что по оплате? Работает или нет?,1.0,2.0,
507,"Зачем то отключили автоплатеж, о том что звонили видишь только в самом приложении уже как пропущенные вызовы (не приходят). Дом ру как всегда делает всё через не пойми что",0.0,1.0,
508,Перед установкой новой версии просит удалить предыдущую версию. Не придется покупать по новой?,1.0,,
509,После обновления всё слетело. Получить новый пароль надо пройти огромный квест и то не гарантия что всё получится. Тех. Поддержка никакая.,0.0,1.0,
510,"Нет функции ""купить по рыночной цене"". Это иногда очень удобный инструмент. Стакан в старой версии более эргономичен, в новой версии огромные прямоугольники только усложняют восприятие. Уведомления, стоп-лосы, тейк-профиты  не испытывал.",1.0,0.0,
511,"Приложение не устанавливается. Просит удалить версию, установленную ранее с плей маркета. А зачем мне удалять, если та версия прекрасно работает и обновляется без всяких там удалений?",0.0,1.0,
512,"Замеры делает, всё ок.",2.0,0.0,
513,Не работает и не обновляется мобильная версия.,0.0,0.0,
514,"Самое корявое приложение какого из банков , не оплатить жкх , через гисжкс ничего не находит просто оплатить нет доступа ОДНИ ПРЕДЛОЖЕНИЯ УСЛУГ бесполезных , приложуха отстой. Если бы не обязательства работодателя то ни за что бы не перешёл на этот банк",0.0,0.0,
515,"При оплате жкх камера не считывает QR код,время прошло не исправили.другие приложения иных банков код считали без проблем.",0.0,1.0,
516,"Нет поддержки Android 7. С гугл плей устанавливается старая версия которая ещё дружит с 7 андроид, а здесь, в русторе, видно что есть обновление но только для 8 андроида 😂 рустор почините своё приложение",0.0,1.0,
517,Не подключается впн что случилось?,1.0,0.0,
518,"Хорошее приложение. Но почему исчезло отображение цены на активных стоп-заявках, верните невозможно понять для какой цены выставлена заявка",1.0,0.0,
519,"Здравствуйте, хотелось бы в личном профиле видеть статистику прибыльности по месяцам и годам.",1.0,0.0,
520,"Здравствуйте, хотелось бы в личном профиле видеть статистику доходности своих инвестиций,  по месяцам и годам.",1.0,0.0,
521,Не заходит в приложение. Спасибо что помогаете терять мои деньги!!! Так держать!!! Всё таки тинькофф лучшие банк РФ!!!,0.0,0.0,
522,"Мне понравилось. Небольшой размер при удобном интерфейсе. Однако, с уведомления звуком проблемы",1.0,0.0,
523,"Отвратительная работа приложения. Работой назвать сложно. За две недели смогла зайти только один раз. Как заходить и управлять, если ничего не работает.",0.0,0.0,
524,"Приложение простое. Нишевое. Полезно будет рыбакам, туристам, дальнобойщикам и другим кто может оказаться в ситуации ""далеко за городом, нет интернета, надо передать свои координаты""",0.0,0.0,
525,"Оператор сдал позиции. Даже когда-то никчемный теле2 и то уже переплюнул в нашем регионе, а ещё и тарифы сумели поднять. Пожалуй пора покинуть вас с таким ""быстрым"" инэтом.",0.0,0.0,
526,"Samsung galaxy S9, полёт нормальный",2.0,,
527,"Верните голосовой режим, Валеру или как его звали!!!",1.0,0.0,
528,Почему номер полиса ОМС при записи к врачу в личном кабинете теперь нужно вводить  каждый раз?,1.0,0.0,
529,Не обновляется пишет файл поврежден или версия некорректна. Новое обновление - проблема такая же,0.0,0.0,
530,Ужасное приложение. Домашнее задание даёт не по всем предметам!,0.0,0.0,
531,Да я только установил приложение как бл... ть я его могу оценить,0.0,0.0,да
532,Техподкржка только промямлила и подарила 200 руб бонус а сгорели 800 бонусов при замене товара по гарантии. Ужас больше сюда не нагой,0.0,1.0,
533,"Приложение не работает на смартфоне через мобильную связь, только через вайфай.",0.0,0.0,
534,"Почему перестало показывать акции на иис,брокерский показывает,иис нет((Да сделайте уже наконец нормальное приложение!",0.0,0.0,
535,"Брать здесь не выгодно ставка 1% , комисия при оплате высокая , а когда вым предлжат 7 дней бесплатно то будет страховка которая не отключанться.",0.0,0.0,
536,"За вывод средств берет комиссию! Ох...просто! Не советую! Столото не берет комиссий и выигрышей там однозначно больше. Наё, а не приложение!",0.0,0.0,
537,"Может хватит все портить????!!!! После обновления невозможно покупки совершать,руки бы вам оторвать за такую работу",0.0,0.0,
538,Броблемы с платежами через qr-код,0.0,0.0,
539,все супер,2.0,,
540,"Проблемы с доставкой в калининград, и вместо того что бы предупреждать об этом они убрали возможность отмены заказа",0.0,1.0,
541,Всё работает. Непонятно зачем обязательное разрешение доступа к местоположению. Если неразрешить приложение неконектица с пином.,1.0,0.0,
542,"Спасибо большое разработчику за приложение. Всё просто и наглядно. Даже мне, пенсионерке,всё понятно и доступно  в распределении своих средств. Желаю дальнейших успехов.",2.0,,
543,Отличное радио!,2.0,,
544,Говнище!!!!,0.0,,да
545,После обновления невозможно зайти в приложение - постоянно идёт загрузка... Лишена возможность пользоваться приложением с телефона.,0.0,0.0,
546,"Скачал сие приложение, установил, запустить так и не получилось,, даже ошибку не пишет.",0.0,0.0,
547,Не работает. Пишет нет соединения с интернетом... Жесть!,0.0,0.0,
548,Очень удобное приложение,2.0,,
549,Работает нормально 👍,2.0,,
550,"Хорошая альтернатива ютубу, если любишь залипать в игры👍",2.0,,
551,Нет доставки до пинчуги,0.0,1.0,
552,После обновления перестал работать,0.0,0.0,
553,приложение слишком перемудрили. невозможно обратиться в службу поддержки. робот тупит,0.0,0.0,
554,Хоть не обновляй приложение. Т.к. каждый раз сбрасывается логин-пароль. А восстановление сделано через одно место,0.0,0.0,
555,"Сделайте пжл что-нибудь  - приложение без конца просит обновить его, хотя уже обновляла не раз. Телефон не Xiomi, a Samsung. И памяти на телефоне очень много занимает. Который день не могу нормально зайти",0.0,0.0,
556,Очень хорошее приложение. Спасибо!,2.0,,
557,Не грузит обновление,0.0,0.0,
558,Как убрать рекламу навсегда? Без подписок?,1.0,0.0,
559,Очень хороший товар,2.0,,
560,"Хорошо, только деньги сосет как пылесос",2.0,,да 
561,"Отличное приложение, работает!",2.0,,
562,Последнее обновление сломало приложение .Miui 13 android 11 тело MI 9T,0.0,0.0,
563,"Сделайте пожалуйста нормальный график торговли, необходимо для просмотра; дневной, недельный, месячный и т.д.. Необходимо в истории видеть какую сумму сняли за непокрытую позицию. ",1.0,0.0,
564,Приложение после перехода на оплату вылетает. Не советую устанавливать.,0.0,2.0,
565,После обновления запускается и через 2 сек закрывается.,0.0,0.0,
566,Как обновить?,1.0,0.0,
567,"часто показывает неверное время прибытия транспорта к остановке,рисует движущиеся фантомы вместо реального электробуса- зачем это делать-не ясно- только вводит пассажиров в заблуждение",0.0,0.0,
568,Гугл защита маркирует как подозрительное приложение - собирает слишком много данных. Не стал обновлять.,0.0,0.0,
569,"Тупое поиложен е ! Работает с тормозами и отператоы тупые ! Вместо ответа по sms или в приложении шлют письма заказные ! Мозгов вообще нет у операторов ,еслизаказные письма отправляют и мне надо ходить за ними на почту!",0.0,0.0,да
570,"Сделайте, пожалуйста, чтобы можно было войти в аккаунт после выхода. В браузере все ок, а приложение не распознает данные учетки. Давно уже",0.0,0.0,
571,"Оплата по СБП недоступна, не получается купить. Как-то через раз выходит.",0.0,2.0,
572,"Два звука, ставлю на паузу и тормозит видео, и останавливается один из двух звуков",0.0,0.0,
573,Заказал справку из ЕГРН за 650 рублей. Скачать справку невозможно кнопка не активна.,0.0,0.0,
574,Сегодня не получилось подключиться. Раньше был отличный впн,0.0,0.0,
575,Отличное приложение. Доставка всегда в срок. Меня всё устраивает,2.0,,
576,"Что значит приложение работает некорректно, надо отметить какие-то вебадреса в настройках, откуда я знаю какие вебадреса надо",0.0,0.0,
577,"Работает хорошо, вопросов нет.",2.0,,
578,Надеюсь проект будет допилен до чего то действительно достойного! Пока-что жду. 5 звездочек для поддержки).,1.0,0.0,
579,"Версия отсюда нормально не показывет уведомления, я таким образом упустил покупателей, отвяжите уведомления от рустора, иначе они не показываются без запуска рустор.",0.0,0.0,
580,"В целом все хорошо. Но.... Часто слушаю на магнитоле в машине, но нету голосового управления. Внедрите Алису. Будет замечательно. СРОЧНО ТРЕБУЮ АЛИСУ В ПРИЛОЖЕНИЕ.",2.0,,
581,"Я просто не понимаю, в чем проблема? Взять приложение любого другого банка, поюзать его и найти 10000000 отличий и сделать как там !!!!!  Ваше приложение самое ущербное , только из за этого я стал клиентом другого банка !!!!",0.0,0.0,
582,"Приложение не рабочее. В чатах сообщения не отправляютя, данные о чатах не загружаются. Задачи вообще не работают. Зачем выкладывать не рабочее приложение?",0.0,0.0,
583,"Газпром и Энергосбыт свои акции завершил, больше ничего интересного нет. Приложение теперь просто занимает место. Можно сносить.",0.0,0.0,
584,"Вчера новая версия вышла, и хотелось бы что нибудь в секторе нового",1.0,0.0,
585,"Не работает, ошибка запроса на экране авторизации",0.0,0.0,
586,"Я бы поиграл конечно побольше чем побег в начале, если бы бы на экране было бы нарисован стик, я разрабатывал игры на юнити и знаю что это просто реализовать, а так не играбельно, но очень красиво.",1.0,0.0,
587,Игра крутая,2.0,,
588,"Почему не могу зайти в приложение? Через vk всплывает белый экран, а по номеру, звонок не поступает.",0.0,0.0,
589,В Челябинской области пусто,1.0,,
590,не работает без Гугл сервисов,0.0,0.0,
591,Хороший сервис! Но лучше Google карт поставьте Яндекс или 2гис!,1.0,1.0,
592,Все работает хорошо!,2.0,,
593,Сделайте перевод без комиссии! Пожалуйста!,1.0,0.0,
594,Приложение удобное! Цены не кусаются! Красота!,2.0,,
595,Верните бесплатный возврат товара и бесплатные пакеты! Раньше было лучше!,1.0,0.0,
596,Удобное приложение!,2.0,,
597,"Приложение работает хорошо, но стоит дополнить интерфейс!",1.0,0.0,
598,Хорошо работает! Удобно!,2.0,,
599,Удобно!,2.0,,
600,Удобное приложение!,2.0,,
601,Приложение работает хорошо!,2.0,,
602,Удобно! Приложение работает хорошо!,2.0,,
603,Почему на старте переключения с волны на волну бъёт максимальный звук по динамикам ?  Ведь можно же доработать для комфорта ..,0.0,0.0,
604,"Отличное приложение . Все понятно, нет ничего лишнего . Вся информация есть . Моя оценка +100",2.0,0.0,
605,"Huawei mate 50 pro на этапе авторизации выдает ошибку ""Упс... Что то пошло не так"", на втором телефоне realme x2pro работает корректно",1.0,0.0,
606,Игра топ в своём жанре.,2.0,,
607,"Открывается и вылетает, на Самсунге.",0.0,0.0,
608,Ошибка 6002,0.0,0.0,
609,Магазин м.видео очень хорошая,2.0,,
610,Плохо,0.0,0.0,
611,"Урегулируйте рекламу, опять пропала. На праздники не поиграть нормально.",0.0,1.0,
612,Очень хорошее приложение,2.0,,
613,"Приложение работает хорошо. Всё корректно отображается, нет проблем в работе. Плюс за последние месяцы в принципе банк стал гораздо лучше (спасибо за категории кэшбэка). Спасибо!",2.0,,
614,Пользуюсь давно,2.0,,
615,"Функционал бедноват. Почему-то нельзя выбрать одновременно фото и видео, только что-то одно. Почему-то не работает автоповорот изображения, надо поворачивать кнопкой. Нельзя сразу видеть инфо об изображении, надо нажать кнопку. Настроек невероятно мало.",0.0,0.0,
616,КРОХОБОРЫ. С заправок процен и с пользователей процентик. Я отлично дойду до кассы и оплачу там.,0.0,2.0,
617,Когда решите вопрос с уведомлениями?,1.0,0.0,
618,"В последние время через приложение не получается брать билеты, только через сайт. Сейчас обновление сделаю посмотрю как будет и напишу комментарий.",1.0,0.0,
619,"Все работает. Как пожелание, добавьте возможность держать в приложении скидочые карты (на подобии как в Samsung Pay). Будет очень удобно!",2.0,,
620,"Ушло  из приложении окно  ""транспорт"", а я пользуюсь общественным транспортом, а не такси, т. к я пенсионер. Прошу вернуть  окно "" Транспорт"", в противном случае, оно мне без надобности. ",1.0,0.0,
621,"Один раз сигнал, далее не могу пополнить счёт, в данной шарашке сказали могут заблокировать счёт без объяснения причин. Подумайте прежде чем нести туда деньги. Всём удачи!",0.0,0.0,
622,"Приложение удобное, операторы вежливые, банк супер",2.0,,
623,"Отличное приложение. Пользуюсь уже много лет. А по случаю, несколько лет назад, даже прикупил пожизненную лицензию. Недавно принял участие в тестировании новых интерфейсов будущих версий, за что получил 30 мин. Крайне приятное приложение.",2.0,,
624,Привет 👋 видео долго грузится у вас прислабом Интернет работает в России медленно зделайте как тик токе лайт ничего лишнего только видео лайк 👍 или дизлайк 👎 отписка писка и все спасибо большое запреложение🌹,0.0,,да
625,Игра постоянно вылетает,0.0,0.0,
626,Отличная вещь,2.0,,
627,Лучший 👍!,2.0,,
628,Не заходит в приложение второй день!!! Исправьте!,0.0,0.0,
629,Хорошее приложение,2.0,,
630,"Нет возможности оплатить yota-интернет через приложение ВТБ. Номер договора с йотой 12 цифр, а ВТБ приложение дает ввести не больше 10.",0.0,0.0,
631,Какой источник погоды? Как оплатить?,1.0,0.0,
632,👍,2.0,,
633,Не запускается:Ошибка.Перезапуск ничего не даёт!,0.0,0.0,
634,Не запускается:Ошибка.Перезапуск ничего не даёт!А раньше не было проблем.Есть о чём вспомнить!,0.0,0.0,
635,"Не запускается:Ошибка.Перезапуск ничего не даёт!А раньше не было проблем.Есть о чём вспомнить!Донаты хорошо просим,а продукт не работает!",0.0,0.0,
636,Не запускается,0.0,0.0,
637,Не работает. После появления логотипа закрывается.,0.0,1.0,
638,После обновления немогу оплатить картой втб,0.0,0.0,
639,Отлично работает приложение,2.0,,
